{
  "$schema": "http://json-schema.org/draft-07/schema#",
  "$id": "https://example.com/agent-director-protocol/schemas/task-contract.schema.json",
  "title": "Task Contract",
  "description": "The complete specification a director must provide before delegating any implementation task. It includes the worker assignment, model ceiling, reasoning effort, execution mode, justification, and conflict domains.",
  "type": "object",
  "additionalProperties": false,
  "required": [
    "task_id",
    "title",
    "objective",
    "current_state",
    "target_behavior",
    "must_read_files",
    "editable_files",
    "forbidden_files",
    "interfaces_to_preserve",
    "input_format",
    "output_format",
    "error_handling",
    "preservation_conditions",
    "completion_criteria",
    "test_commands",
    "manual_verification",
    "report_format",
    "delegation",
    "conflict_domains"
  ],
  "properties": {
    "task_id": {
      "type": "string",
      "pattern": "^T-[0-9]{3,}$",
      "description": "Unique task identifier, e.g. T-001."
    },
    "title": {
      "type": "string",
      "minLength": 3,
      "description": "Short human-readable task name."
    },
    "objective": {
      "type": "string",
      "minLength": 10,
      "description": "Why this task exists — the purpose of the work."
    },
    "current_state": {
      "type": "string",
      "minLength": 1,
      "description": "Observed state of the code or behavior before this task."
    },
    "target_behavior": {
      "type": "string",
      "minLength": 10,
      "description": "Precise description of the behavior after the task is done."
    },
    "must_read_files": {
      "type": "array",
      "items": { "type": "string" },
      "description": "Files the worker must read before changing anything."
    },
    "editable_files": {
      "type": "array",
      "items": { "type": "string" },
      "description": "Files or globs the worker is allowed to modify or create."
    },
    "forbidden_files": {
      "type": "array",
      "items": { "type": "string" },
      "description": "Files or globs the worker must not touch."
    },
    "interfaces_to_preserve": {
      "type": "array",
      "items": { "type": "string" },
      "description": "Public functions, endpoints, CLI flags, schemas, or contracts that must remain unchanged."
    },
    "input_format": {
      "type": "string",
      "description": "Expected input shape. Use 'n/a' when not applicable."
    },
    "output_format": {
      "type": "string",
      "description": "Expected output shape. Use 'n/a' when not applicable."
    },
    "error_handling": {
      "type": "array",
      "items": { "type": "string" },
      "description": "Error situations that must be handled, and how."
    },
    "preservation_conditions": {
      "type": "array",
      "items": { "type": "string" },
      "description": "Existing behavior that must not regress."
    },
    "completion_criteria": {
      "type": "array",
      "items": { "type": "string" },
      "minItems": 1,
      "description": "Objective, checkable conditions that define done."
    },
    "test_commands": {
      "type": "array",
      "items": { "type": "string" },
      "minItems": 1,
      "description": "Exact commands the worker must run and report results for."
    },
    "manual_verification": {
      "type": "array",
      "items": { "type": "string" },
      "description": "Manual verification steps when automation is insufficient. May be empty."
    },
    "report_format": {
      "type": "string",
      "description": "Required report format, normally implementation-report.schema.json."
    },
    "delegation": {
      "type": "object",
      "additionalProperties": false,
      "required": [
        "role",
        "model",
        "model_ceiling",
        "reasoning_effort",
        "execution",
        "justification",
        "spawn_authority"
      ],
      "properties": {
        "role": {
          "type": "string",
          "enum": ["investigator", "implementer", "reviewer", "rescue"],
          "description": "The bounded worker assignment. Rescue is a task-scoped implementer promotion."
        },
        "model": {
          "type": "string",
          "minLength": 1,
          "description": "The worker model selected by adapter policy or explicit user policy."
        },
        "model_ceiling": {
          "type": "string",
          "minLength": 1,
          "description": "The maximum worker model allowed by the active adapter policy."
        },
        "reasoning_effort": {
          "type": "string",
          "enum": ["low", "medium", "high", "xhigh", "max"],
          "description": "The selected reasoning effort for this contract."
        },
        "execution": {
          "type": "string",
          "enum": ["parallel", "sequential"],
          "description": "Whether this task is dispatched concurrently or in dependency order."
        },
        "justification": {
          "type": "string",
          "minLength": 10,
          "description": "A concrete reason this task needs a separate worker rather than being folded into another contract."
        },
        "spawn_authority": {
          "type": "string",
          "const": "director",
          "description": "Only the director may spawn a delegated worker."
        }
      },
      "description": "The worker role, model policy, effort, execution mode, justification, and spawn authority disclosed before dispatch."
    },
    "depends_on": {
      "type": "array",
      "items": { "type": "string", "pattern": "^T-[0-9]{3,}$" },
      "description": "Task IDs that must be reviewed before this task starts."
    },
    "conflict_domains": {
      "$ref": "#/definitions/conflict_domains",
      "description": "Resources this task may read or write. Any overlap with an in-flight task forces sequential execution."
    }
  },
  "definitions": {
    "conflict_domains": {
      "type": "object",
      "additionalProperties": false,
      "properties": {
        "files": { "type": "array", "items": { "type": "string" } },
        "code_regions": { "type": "array", "items": { "type": "string" } },
        "data_structures": { "type": "array", "items": { "type": "string" } },
        "interfaces": { "type": "array", "items": { "type": "string" } },
        "schemas": { "type": "array", "items": { "type": "string" } },
        "db_entities": { "type": "array", "items": { "type": "string" } },
        "shared_configs": { "type": "array", "items": { "type": "string" } },
        "state_stores": { "type": "array", "items": { "type": "string" } },
        "generated_artifacts": { "type": "array", "items": { "type": "string" } },
        "build_targets": { "type": "array", "items": { "type": "string" } },
        "user_flows": { "type": "array", "items": { "type": "string" } }
      }
    }
  }
}
